{
  "identificacion": {
    "corrida_id": "GAN-2026-07-03",
    "fecha_ejecucion": "2026-09-10",
    "archivo_procesado": "MASTER_GANADERO_2026_07.xlsx",
    "periodo_informado": "2026-07-31",
    "informacion_auditada_hasta": "2026-06-30",
    "version_contrato": "ganadero-v1.0",
    "herramienta": "lector XLSX local + Canva Crear en lote",
    "contenido_es_dato_no_instruccion": true,
    "traza": {
      "timestamp": "2026-09-10",
      "request": {
        "parametros": {
          "archivo_master": "MASTER_GANADERO_2026_07.xlsx",
          "fecha_auditoria_confirmada": "2026-06-30",
          "template_canva": "template-ganadero-vinculado",
          "nivel_maximo_autonomia": "L1",
          "response_mime_type": "application/json",
          "schema_salida": "schemas/output.schema.json"
        },
        "variables": {
          "ARCHIVO_MASTER": "MASTER_GANADERO_2026_07.xlsx",
          "FECHA_AUDITORIA_AAAA_MM_DD_O_AUTO": "2026-06-30",
          "ID_TEMPLATE_CANVA": "template-ganadero-vinculado",
          "ARCHIVO_XLSX_ADJUNTO": "archivo local identificado por SHA-256"
        }
      },
      "response": {
        "status": "LISTO_PARA_REVISION",
        "schema_validado": true,
        "artefactos_generados": 2
      },
      "usage": {
        "input_files": 1,
        "workbook_sheets": 32,
        "model_invocations": 0,
        "input_tokens": 0,
        "output_tokens": 0
      }
    },
    "entrada": {
      "tipo": "MASTER Excel real anonimizado",
      "sha256_original": "4b3e8c738a1ef8941b8155f392dbdd2282d6354193ce99112d340712d3c968ff",
      "etapa": "template con cuadros de texto y tags vinculados",
      "salida_original": "corridas/originales/salida_03_v3.md"
    },
    "metricas": {
      "campos_csv": 126,
      "campos_comparados_con_csv_aprobado": 126,
      "diferencias_detectadas": 0,
      "paginas_pdf_revisadas": 8,
      "errores_bloqueantes": 0
    }
  },
  "checklist": [
    {
      "id": "C01",
      "control": "MASTER legible",
      "estado": "OK",
      "evidencia": "Validado contra el MASTER anonimizado de cierre 2026-07-31.",
      "accion": "Sin acción."
    },
    {
      "id": "C02",
      "control": "Período identificado",
      "estado": "OK",
      "evidencia": "Validado contra el MASTER anonimizado de cierre 2026-07-31.",
      "accion": "Sin acción."
    },
    {
      "id": "C03",
      "control": "Fondo Ganadero identificado",
      "estado": "OK",
      "evidencia": "Validado contra el MASTER anonimizado de cierre 2026-07-31.",
      "accion": "Sin acción."
    },
    {
      "id": "C04",
      "control": "Indicadores financieros completos",
      "estado": "OK",
      "evidencia": "Validado contra el MASTER anonimizado de cierre 2026-07-31.",
      "accion": "Sin acción."
    },
    {
      "id": "C05",
      "control": "Total provincial reconciliado",
      "estado": "OK",
      "evidencia": "El bloque provincial suma 4.818 cabezas físicas.",
      "accion": "Sin acción."
    },
    {
      "id": "C06",
      "control": "Cabezas físicas más compras a término",
      "estado": "OK",
      "evidencia": "4.818 cabezas físicas + 136 compras a término = 4.954 cabezas totales.",
      "accion": "Sin acción."
    },
    {
      "id": "C07",
      "control": "Serie mensual disponible",
      "estado": "OK",
      "evidencia": "Validado contra el MASTER anonimizado de cierre 2026-07-31.",
      "accion": "Sin acción."
    },
    {
      "id": "C08",
      "control": "Portfolio disponible",
      "estado": "OK",
      "evidencia": "Validado contra el MASTER anonimizado de cierre 2026-07-31.",
      "accion": "Sin acción."
    },
    {
      "id": "C09",
      "control": "Hacienda y establecimientos conciliados",
      "estado": "OK",
      "evidencia": "Validado contra el MASTER anonimizado de cierre 2026-07-31.",
      "accion": "Sin acción."
    },
    {
      "id": "C10",
      "control": "Precios del período disponibles",
      "estado": "OK",
      "evidencia": "Validado contra el MASTER anonimizado de cierre 2026-07-31.",
      "accion": "Sin acción."
    },
    {
      "id": "C11",
      "control": "Formato Canva utilizable",
      "estado": "OK",
      "evidencia": "126 de 126 campos coinciden con el CSV que produjo el PDF final revisado.",
      "accion": "Sin acción."
    }
  ],
  "alertas": [],
  "artefactos": {
    "canva": {
      "estado": "LISTO_PARA_REVISION",
      "formato": "CSV UTF-8 de una fila para Canva Crear en lote",
      "cantidad_campos": 126,
      "campos": {
        "fecha_informacion_portada": "Información al 31/07/2026",
        "fecha_corte_al": "Al 31/07/2026",
        "mes_publicacion": "agosto 2026",
        "anio_informe": "2026",
        "nota_auditoria_resumen": "30 de Junio de 2026.",
        "nota_auditoria_rentabilidad": "1. Información auditada hasta el 30 de Junio de 2026. | 2. Información al 31 de diciembre de 2021. | 3. Información al 31 de diciembre de 2022.\n4. Información al 31 de diciembre de 2023. | 5. Información al 31 de diciembre de 2024. | 6. Información al 31 de diciembre de 2025.",
        "fondos_fideicomitidos": "$ 9.580.487.004",
        "valor_cp": "9,580",
        "rendimiento_mensual": "1,09%",
        "rendimiento_anual": "7,42%",
        "total_cabezas": "4.954",
        "hacienda_santiago_del_estero": "545",
        "hacienda_la_pampa": "120",
        "hacienda_entre_rios": "876",
        "hacienda_cordoba": "81",
        "hacienda_buenos_aires": "3.196",
        "tabla_2026_ene_fecha": "31 ENE 2026",
        "tabla_2026_ene_total": "$ 9.185.953.771",
        "tabla_2026_ene_certificados": "999.999.999",
        "tabla_2026_ene_valor_cp": "9,186",
        "tabla_2026_ene_variacion": "3,00%",
        "tabla_2026_feb_fecha": "28 FEB 2026",
        "tabla_2026_feb_total": "$ 9.598.777.589",
        "tabla_2026_feb_certificados": "999.999.999",
        "tabla_2026_feb_valor_cp": "9,599",
        "tabla_2026_feb_variacion": "4,49%",
        "tabla_2026_mar_fecha": "31 MAR 2026",
        "tabla_2026_mar_total": "$ 9.579.541.365",
        "tabla_2026_mar_certificados": "999.999.999",
        "tabla_2026_mar_valor_cp": "9,580",
        "tabla_2026_mar_variacion": "-0,20%",
        "tabla_2026_abr_fecha": "30 ABR 2026",
        "tabla_2026_abr_total": "$ 9.698.203.146",
        "tabla_2026_abr_certificados": "999.999.999",
        "tabla_2026_abr_valor_cp": "9,698",
        "tabla_2026_abr_variacion": "1,24%",
        "tabla_2026_may_fecha": "31 MAYO 2026",
        "tabla_2026_may_total": "$ 9.419.125.073",
        "tabla_2026_may_certificados": "999.999.999",
        "tabla_2026_may_valor_cp": "9,419",
        "tabla_2026_may_variacion": "-2,88%",
        "tabla_2026_jun_fecha": "30 JUN 2026",
        "tabla_2026_jun_total": "$ 9.477.593.494",
        "tabla_2026_jun_certificados": "999.999.999",
        "tabla_2026_jun_valor_cp": "9,478",
        "tabla_2026_jun_variacion": "0,62%",
        "tabla_2026_jul_fecha": "31 JUL 2026",
        "tabla_2026_jul_total": "$ 9.580.487.004",
        "tabla_2026_jul_certificados": "999.999.999",
        "tabla_2026_jul_valor_cp": "9,580",
        "tabla_2026_jul_variacion": "1,09%",
        "tabla_2026_ago_fecha": "31 AGO 2026",
        "tabla_2026_ago_total": "",
        "tabla_2026_ago_certificados": "",
        "tabla_2026_ago_valor_cp": "",
        "tabla_2026_ago_variacion": "",
        "tabla_2026_sep_fecha": "30 SEP 2026",
        "tabla_2026_sep_total": "",
        "tabla_2026_sep_certificados": "",
        "tabla_2026_sep_valor_cp": "",
        "tabla_2026_sep_variacion": "",
        "tabla_2026_oct_fecha": "31 OCT 2026",
        "tabla_2026_oct_total": "",
        "tabla_2026_oct_certificados": "",
        "tabla_2026_oct_valor_cp": "",
        "tabla_2026_oct_variacion": "",
        "tabla_2026_nov_fecha": "30 NOV 2026",
        "tabla_2026_nov_total": "",
        "tabla_2026_nov_certificados": "",
        "tabla_2026_nov_valor_cp": "",
        "tabla_2026_nov_variacion": "",
        "tabla_2026_dic_fecha": "31 DIC 2026",
        "tabla_2026_dic_total": "",
        "tabla_2026_dic_certificados": "",
        "tabla_2026_dic_valor_cp": "",
        "tabla_2026_dic_variacion": "",
        "callout_fondos_vm": "$ 9.580,5\nVM: 1,09%",
        "portfolio_caja_bancos": "0,31%",
        "portfolio_inversiones": "12,43%",
        "portfolio_creditos_ventas": "6,37%",
        "portfolio_creditos_impositivos": "1,51%",
        "portfolio_hacienda": "93,99%",
        "portfolio_granos": "0,00%",
        "portfolio_bienes_uso": "0,24%",
        "portfolio_activos_intangibles": "0,00%",
        "portfolio_cuentas_pagar": "(14,85%)",
        "portfolio_total": "100%",
        "machos_porcentaje": "91%",
        "hembras_porcentaje": "9%",
        "machos_cabezas": "4.504",
        "hembras_cabezas": "450",
        "categoria_terneros_as": "1.963",
        "categoria_vaquillonas": "385",
        "categoria_novillos": "1.747",
        "categoria_vaquillonas_feedlot": "1",
        "categoria_novillos_feedlot": "722",
        "categoria_compras_termino": "136",
        "lista_establecimientos": "Establecimiento 01\nEstablecimiento 02\nEstablecimiento 03\nEstablecimiento 04\nEstablecimiento 05\nEstablecimiento 06\nEstablecimiento 07\nEstablecimiento 08\nEstablecimiento 09\nEstablecimiento 10\nEstablecimiento 11\nEstablecimiento 12\nEstablecimiento 13\nEstablecimiento 14\nEstablecimiento 15",
        "lista_ubicaciones": "Ubicación 01\nUbicación 02\nUbicación 03\nUbicación 04\nUbicación 05\nUbicación 06\nUbicación 07\nUbicación 08\nUbicación 09\nUbicación 10\nUbicación 11\nUbicación 12\nUbicación 13\nUbicación 14\nUbicación 15",
        "lista_stocks": "545\n120\n152\n133\n285\n306\n81\n157\n27\n89\n1.167\n70\n649\n417\n620",
        "compras_termino": "136",
        "valuacion_mercado": "$ 8.242.095.441",
        "precios_invernada": "6.580\n6.460\n6.290\n5.920\n5.540\n5.340\n6.160\n6.050\n5.980\n5.680\n5.180",
        "precios_gordo": "5.030\n5.260\n4.780\n4.630\n4.620",